{
  "messageId": "message-id-example",
  "type": "AddIceCandidate",
  "version": "1.0.0",
  "occurredAt": "2026-09-08T12:00:00Z",
  "tenantId": "tenant-id-example",
  "regionId": "region-id-example",
  "clusterId": "cluster-id-example",
  "correlationId": "correlation-id-example",
  "data": {
    "sessionId": "session-id-example",
    "ownerEpoch": "1",
    "playerId": "player-id-example",
    "negotiationId": "negotiation-id-example",
    "candidate": "example",
    "sdpMid": "example",
    "sdpMLineIndex": 0
  },
  "idempotencyKey": "idempotency-key-example"
}
